User Input,Chatbot Response,Timestamp
hi ,"Solar energy is cost-effective in the long run, while wind energy provides clean power without greenhouse gas emissions.",2025-03-14 13:41:12
hi,"Renewable energy comes from natural sources like the sun, wind, and water. It helps reduce carbon emissions and dependence on fossil fuels.",2025-03-14 13:41:25
hi,Hello,2025-03-14 14:32:28
eco tips,"You can reduce your carbon footprint by using renewable energy, recycling, and reducing waste.",2025-03-14 14:32:32
hi,Hey,2025-03-14 14:35:56
How can I reduce my carbon footprint?,"Your carbon footprint measures the greenhouse gases your activities generate. Reduce it by switching to renewable energy, recycling, and using energy-efficient appliances.",2025-03-14 15:37:37
What are green certifications?,"Green certifications, like ISO 14001 and LEED, verify a business’s commitment to sustainability. They enhance credibility and attract eco-conscious customers.",2025-03-14 15:38:22
